{
  "report_id": "validation-2026-05-02",
  "artifact_ids": ["claim_records", "candidate_analysis", "comparison_report", "editorial_packages", "site_metadata"],
  "status": "pass",
  "checks": [
    {
      "rule_id": "empty_inbox_batches_require_resolution",
      "level": "block",
      "status": "pass",
      "artifact_ref": "data/inbox/*/batch_status.json",
      "message": "Los lotes vacios del inbox tienen una resolucion explicita o ya contienen fuentes capturadas."
    },
    {
      "rule_id": "primary_program_documents_registered",
      "level": "block",
      "status": "pass",
      "artifact_ref": "program_documents",
      "message": "Cada candidatura activa de la watchlist ya tiene un documento oficial primario registrado."
    },
    {
      "rule_id": "primary_program_documents_markdown_ready",
      "level": "block",
      "status": "pass",
      "artifact_ref": "program_documents",
      "message": "Los documentos oficiales primarios de la watchlist tienen Markdown disponible para análisis."
    },
    {
      "rule_id": "primary_program_documents_quality",
      "level": "warn",
      "status": "pass",
      "artifact_ref": "program_documents",
      "message": "Los documentos oficiales primarios disponibles no muestran señales obvias de conversión deficiente."
    },
    {
      "rule_id": "traceability_required",
      "level": "block",
      "status": "pass",
      "artifact_ref": "candidate_analysis|comparison_report|editorial_packages",
      "message": "Todos los artefactos analíticos conservan source_ids y claim_ids trazables."
    },
    {
      "rule_id": "description_inference_evaluation_split",
      "level": "block",
      "status": "pass",
      "artifact_ref": "candidate_analysis|editorial_packages",
      "message": "Los artefactos distinguen descripción, inferencia y evaluación."
    },
    {
      "rule_id": "symmetric_comparison",
      "level": "block",
      "status": "pass",
      "artifact_ref": "comparison_report",
      "message": "La comparación usa la misma estructura para todos los candidatos incluidos."
    },
    {
      "rule_id": "explicit_uncertainty",
      "level": "warn",
      "status": "pass",
      "artifact_ref": "candidate_analysis|comparison_report",
      "message": "Las incertidumbres relevantes están explicitadas."
    },
    {
      "rule_id": "no_partisan_language",
      "level": "block",
      "status": "pass",
      "artifact_ref": "candidate_analysis|comparison_report|editorial_packages",
      "message": "No se detectó lenguaje partidista evidente en los artefactos publicables."
    },
    {
      "rule_id": "feasibility_required_for_programmatic_analysis",
      "level": "warn",
      "status": "pass",
      "artifact_ref": "candidate_analysis|comparison_report",
      "message": "La factibilidad está cubierta en las salidas programáticas."
    },
    {
      "rule_id": "vague_promises_not_overstated",
      "level": "warn",
      "status": "pass",
      "artifact_ref": "candidate_analysis",
      "message": "Las promesas vagas quedaron marcadas como limitación analítica."
    }
  ],
  "summary": "Validation passed with no blocking issues."
}
